{
  "schema_version": "1.0",
  "project": {
    "title": "The Unfinished Shadow",
    "franchise": "Star Wars (Legends EU)"
  },
  "claims": [
    {
      "claim_id": "clm_0001",
      "entity_type": "intent",
      "entity_id": "book",
      "field": "one_sentence_pitch",
      "value": "Ben Skywalker, three years after Fate of the Jedi and quietly hungry for meaningful work, is pulled into a post-war conspiracy around a duplicated wartime shipment manifest his cousin Jacen Solo personally encrypted before his death — and forced to discover that the GAG-era lessons Jacen left inside him still work, even when saving lives requires using them.",
      "origin": "import",
      "confidence": "explicit",
      "status": "confirmed",
      "impact": "blocking",
      "source_quote": "imported from idea_session/capture.json",
      "created_at": "2026-10-26T17:31:06+00:00"
    },
    {
      "claim_id": "clm_0002",
      "entity_type": "intent",
      "entity_id": "book",
      "field": "reader_promise",
      "value": "A post-Fate of the Jedi Legends conspiracy thriller written to commercial-novel quality: murder, clue, prison break, uneasy partnership, archive attack, respected charity with a hidden inner ring, offworld Force-site climax, rescue, duel, and a morally dangerous ending. Ben as protagonist; Talon Veyr as wounded rogue partner; Aevyn Soris as Ben's true mirror — the other student of Jacen, the side project who lived in the gaps.",
      "origin": "import",
      "confidence": "explicit",
      "status": "confirmed",
      "impact": "blocking",
      "source_quote": "imported from idea_session/capture.json",
      "created_at": "2026-10-26T17:31:06+00:00"
    },
    {
      "claim_id": "clm_0003",
      "entity_type": "intent",
      "entity_id": "book",
      "field": "emotional_core",
      "value": "Can Ben face what Jacen left inside him without becoming another unfinished piece of Jacen's legacy?",
      "origin": "import",
      "confidence": "explicit",
      "status": "confirmed",
      "impact": "blocking",
      "source_quote": "imported from idea_session/capture.json",
      "created_at": "2026-10-26T17:31:06+00:00"
    },
    {
      "claim_id": "clm_0004",
      "entity_type": "intent",
      "entity_id": "book",
      "field": "author_intent",
      "value": "Reader pleasure before theme. The reader should finish remembering a tense Star Wars adventure with Ben Skywalker, a great rogue partner, a creepy Jacen legacy mystery, an offworld Force-site climax, and a morally dangerous ending. Only afterward should the deeper themes — restraint can cost lives, Jacen's crisis logic can save lives, forbidden knowledge may be necessary to heal or protect people — fully settle in. Ben's danger is not that he wants to become Jacen; it is that he wants to make sure Jacen was not meaningless.",
      "origin": "import",
      "confidence": "explicit",
      "status": "confirmed",
      "impact": "strong",
      "source_quote": "imported from idea_session/capture.json",
      "created_at": "2026-10-26T17:31:06+00:00"
    },
    {
      "claim_id": "clm_0005",
      "entity_type": "intent",
      "entity_id": "book",
      "field": "non_negotiables",
      "value": [
        "Post-Fate of the Jedi Legends continuity; Legacy comics did not happen.",
        "Brooks Story Engineering as loose architectural overlay across 38 chapters; milestones LOCKED to chapter numbers in Chapter Outlines v4.0.",
        "Hook (Ch 1) is one sustained Elya Rane chapter through her death; Aevyn frightens before he is understood.",
        "First Plot Point (Ch 9, ~24%) is the storm-line prison escape — forced partnership with Talon is the door Ben cannot return through.",
        "Midpoint (Ch 16) carries Iressa's two-part dying transmission (documentary chain + identity-shaping revelation) and Ben's pivot from investigator to active disruptor after holo calls to Luke and Saba.",
        "PP2 (Ch 20) is the three-part Squeeze: Tess clears Korda, the cache is raided/burned, Talon is framed with Tess's tradecraft fingerprint, and the Iresh acceleration closes every door except going off-grid.",
        "Climax (Ch 31-32) is rescue first, duel second; the Glasswell sequence saves Tavi and locals BEFORE the Ben/Aevyn lightsaber duel.",
        "Ben preserves the unfinished holocron; his answer to Luke in Ch 36 is technically true and morally incomplete. Luke senses it and does not force the answer.",
        "Final image (Ch 38): cold white-blue spark in the dark below the broken Glasswell — Aevyn survived.",
        "Jedi Order HQ is Shedu Maad (Hapes Cluster); Saba Sebatyne is Grand Master; Luke is senior Master, stepped back, post-Crucible quieter. Coruscant has no Jedi institutional footing.",
        "The Vigil/Foundation is hard to attack because the Foundation's public charitable work is REAL; Aelia's warmth is real.",
        "Iresh is a place before it is a metaphor; it preserves charged impressions, it does not reveal truth or prophecy.",
        "Investigation reader-facing vocabulary: fragment, duplicate manifest, quarantine disguise, archive, Foundation link, Iresh manifest/authorization. NO procedural jargon stacks.",
        "Iressa dies with agency, denying the enemy a clean copy; her death is not reducible to a lesson for Ben.",
        "Ben's holocron omission BEGINS in Act Three (Ch 33-34), not just in the coda."
      ],
      "origin": "import",
      "confidence": "explicit",
      "status": "confirmed",
      "impact": "strong",
      "source_quote": "imported from capture.json",
      "created_at": "2026-10-26T17:31:06+00:00"
    },
    {
      "claim_id": "clm_0006",
      "entity_type": "intent",
      "entity_id": "book",
      "field": "avoid",
      "value": [
        "Vestara Khai as active participant (mention only — Vara's archive scar-tissue line).",
        "Tahiri Veila on-page (single passing reference allowed if natural; no Caedus mention).",
        "Han and Leia as active participants (mention only; effectively retired post-Crucible).",
        "Allana / Amelia as POV or active participant (hidden engine, future danger).",
        "Jaina Solo as active participant (deliberately excluded — bringing her in would be using her grief).",
        "Full reveal of Darth Krayt / the One Sith — the hand is glimpsed or implied only.",
        "Galactic war — this is a postwar investigation, not a war story.",
        "Full Dorvan brainwashing — Dorvan is a FUTURE target, not an already-compromised puppet.",
        "Major cloning plot — Crosscurrent/Riptide connective tissue stays background only.",
        "Mortis monolith / Father-Son-Daughter mythology as plot — Crucible aftermath is Luke's unspoken texture, not on-page.",
        "Imitating any specific published Star Wars author's prose; use broad franchise feel only.",
        "Lines that sound wiser, cooler, or more poetic than the character would naturally be.",
        "Theme announced as thesis statement in prose or dialogue. Theme is shown through behavior, pressure, cost, consequence.",
        "More than one invented bureaucratic/technical term per paragraph in Act 2; every technical phrase translated to human stakes within two sentences.",
        "Ben repeatedly asking himself 'Am I becoming Jacen?'. Stronger: other characters react to him before he fully admits what they saw."
      ],
      "origin": "import",
      "confidence": "explicit",
      "status": "confirmed",
      "impact": "strong",
      "source_quote": "imported from capture.json",
      "created_at": "2026-10-26T17:31:06+00:00"
    },
    {
      "claim_id": "clm_0007",
      "entity_type": "plot",
      "entity_id": "main",
      "field": "premise",
      "value": "What if Jacen Solo's most dangerous bequest to his cousin Ben isn't the dead-end of Caedus, but the unfinished holocron and quiet crisis-logic lessons that — three years after Jacen's death — still work, still save lives, and still demand the only kind of compromise no Skywalker should be able to defend? And what if the surviving student Jacen never gave his full attention to — the side project who lived in the gaps — is the one who finally makes Ben see that the lessons worked on him too?",
      "origin": "import",
      "confidence": "explicit",
      "status": "confirmed",
      "impact": "blocking",
      "source_quote": "imported from concept_seed.premise.what_if",
      "created_at": "2026-10-26T17:31:06+00:00"
    },
    {
      "claim_id": "clm_0008",
      "entity_type": "plot",
      "entity_id": "main",
      "field": "logline",
      "value": "Three years after Fate of the Jedi, a 21-year-old Ben Skywalker is pulled into a post-war conspiracy around a duplicated wartime shipment manifest his cousin Jacen Solo personally encrypted before his death — and forced to discover that the GAG-era lessons Jacen left inside him still work, even when saving lives requires using them.",
      "origin": "import",
      "confidence": "explicit",
      "status": "confirmed",
      "impact": "strong",
      "source_quote": "imported from concept_seed.premise.logline",
      "created_at": "2026-10-26T17:31:06+00:00"
    },
    {
      "claim_id": "clm_0009",
      "entity_type": "plot",
      "entity_id": "main",
      "field": "central_conflict",
      "value": {
        "type": "civic conspiracy with mythic Force shadow",